{
  "dataset_name": "llmops-cpt-sample",
  "dataset_version": "dataset-v2",
  "format": "jsonl",
  "text_field": "text",
  "source": "local-cpt-sample",
  "language": "en",
  "splits": {
    "train": "cpt/train.sample.jsonl",
    "validation": "cpt/validation.sample.jsonl",
    "test": "cpt/test.sample.jsonl"
  }
}
